{
  "$schema": "./schemas/awdf.schema.json",
  "format": "awdf",
  "format_name": "AI Workspace Description Format",
  "format_version": "2.0.0",
  "metadata": {
    "report_id": "awdf_35ed93491f9a4a9e",
    "title": "Esempio dimostrativo · AWDF 2.0",
    "created_at": "2026-10-09T22:06:06.307Z",
    "updated_at": null,
    "language": "it",
    "generator": {
      "name": "AI Setup Classifier",
      "version": "2.0.0"
    },
    "analysis_level": "deep"
  },
  "workspace": {
    "id": "workspace",
    "name": "Example codex",
    "type": "project",
    "purpose": "Maintain application architecture and tests"
  },
  "scope": {
    "authorized_folders": [
      "."
    ],
    "excluded": [
      "node_modules",
      "dist",
      ".git",
      ".vite",
      "coverage",
      ".cache",
      ".pytest_cache",
      "__pycache__",
      "venv",
      ".venv",
      "site-packages",
      ".tools",
      "target",
      "vendor",
      ".sandbox",
      ".sandbox-bin",
      ".sandbox-secrets",
      ".tmp",
      "tmp",
      "cache",
      "sessions",
      "archived_sessions",
      "sqlite",
      "logs",
      "memories",
      "attachments",
      "browser",
      "computer-use",
      "mcp-oauth-locks",
      "process_manager",
      "thread-writer-locks",
      "visualizations",
      "vendor_imports",
      ".env*"
    ],
    "path_representation": "relative",
    "chat_source_policy": {
      "opted_in": false,
      "eligible_analysis_level": true,
      "samples_included": false,
      "directories": [
        "sessions",
        "chats",
        "conversations"
      ],
      "max_examples": 30,
      "full_responses_included": false,
      "redaction": "best_effort",
      "secrets_redacted": false
    }
  },
  "methodology": {
    "mode": "read_only",
    "analysis_depth": "deep",
    "quality_over_quantity": true,
    "behavior_contract_evaluated_separately": false,
    "component_descriptions_and_triggers_extracted": true,
    "executed_discovered_code": false,
    "sensitive_file_contents_excluded": true,
    "chat_redaction": "best_effort",
    "reference_tool_resolution": {
      "standard": "reference_tool_resolution_v2",
      "declared_tools": [
        {
          "id": "codex",
          "role": "primary",
          "mode": "codex_cli",
          "version": null
        }
      ],
      "requested": "auto",
      "status": "declared",
      "primary_tool_ids": [
        "cmp_b1c0475b6a"
      ],
      "primary_tool_keys": [
        "codex"
      ],
      "applicable_tool_ids": [
        "cmp_b1c0475b6a"
      ],
      "applicable_tool_keys": [
        "codex"
      ],
      "detected_tool_keys": [
        "codex"
      ],
      "candidates": [
        {
          "tool_id": "codex",
          "confidence": 0.99,
          "evidence_paths": [
            ".codex/config.toml"
          ],
          "reason": "exclusive_evidence"
        },
        {
          "tool_id": "github_copilot",
          "confidence": 0.55,
          "evidence_paths": [
            "AGENTS.md"
          ],
          "reason": "shared_compatibility_only"
        }
      ],
      "rule": "Explicit tool roles; signatures corroborate configuration only. Declared runtime versions remain unverified."
    },
    "ai_tool_rule_standard": {
      "version": "vendor_rule_profiles_v2",
      "common_core": [
        "exact_path_signatures",
        "canonicalOwner",
        "recognizedBy",
        "surface",
        "scope",
        "enforcement",
        "validity",
        "lifecycle",
        "static_vs_runtime"
      ],
      "overlays_applied": [
        "codex"
      ],
      "multiple_profiles_are_additive": true
    },
    "knowledge_base_standard": {
      "version": "managed_retrievable_corpus_v1",
      "rule": "Corpus gestito di più fonti o record con scopo e recupero definiti; un README o documento singolo non basta."
    },
    "tool_usage_standard": {
      "version": "tool_usage_evidence_v1",
      "used": "Invocazione strutturata osservata in log o sessione autorizzata.",
      "configured": "Dipendenza o configurazione presente; prova disponibilità, non uso.",
      "mentioned": "Nome nel testo di un prompt; non prova installazione né uso."
    },
    "output_role": "description_only"
  },
  "inventory": {
    "file_count": 6,
    "directory_count": 4,
    "workspace_folder_count": 1,
    "manual_component_count": 0
  },
  "components": [
    {
      "id": "cmp_b1c0475b6a",
      "kind": "tool",
      "subtype": "reference_ai_coding_tool",
      "name": "Codex",
      "description": "Codex (OpenAI) rilevato tramite firme esclusive e analizzato con le regole ufficiali del vendor.",
      "path": ".codex/config.toml",
      "parent_id": null,
      "properties": {
        "setup_category": "tool_integrations",
        "lifecycle": {
          "declared": true,
          "configured": true,
          "availability_verified": false,
          "invocation_observed": false,
          "outcome_verified": false
        },
        "tool_id": "codex",
        "vendor": "OpenAI",
        "usage_status": "configured",
        "usage_standard": "tool_usage_evidence_v1",
        "reference_role": "primary",
        "detection_signals": [
          {
            "kind": "exclusive_artifact",
            "path": ".codex/config.toml",
            "detail": "codex_project_config"
          }
        ],
        "official_documentation": [
          "https://learn.chatgpt.com/docs/agent-configuration/agents-md",
          "https://learn.chatgpt.com/docs/agent-configuration/rules",
          "https://learn.chatgpt.com/docs/config-file/config-basic",
          "https://learn.chatgpt.com/docs/enterprise/managed-configuration"
        ],
        "confidence_interpretation": "Heuristic weight, not a calibrated probability"
      },
      "tags": [
        "tool_integrations"
      ],
      "confidence": 0.99,
      "verification_status": "declared_only",
      "evidence_ids": [
        "ev_345ed6a1b7"
      ],
      "activation": {
        "mode": "conditional",
        "triggers": [
          {
            "type": "component_presence",
            "value": "codex",
            "weight": 0.99
          }
        ]
      },
      "usage_status": "configured"
    },
    {
      "id": "cmp_13f2bb218e",
      "kind": "configuration",
      "subtype": "codex_configuration",
      "name": "config.toml",
      "description": "Configurazione Codex; 2 binding surface-specific, stato sintattico unverified.",
      "path": ".codex/config.toml",
      "parent_id": null,
      "properties": {
        "setup_category": "tool_integrations",
        "lifecycle": {
          "declared": true,
          "configured": true,
          "availability_verified": false,
          "invocation_observed": false,
          "outcome_verified": false
        },
        "artifactPath": ".codex/config.toml",
        "format": "codex_project_config",
        "ruleKind": "codex_configuration",
        "canonicalOwner": "openai_codex",
        "recognizedBy": [
          {
            "tool": "codex",
            "surface": "codex_cli",
            "mode": "native",
            "enforcement": {
              "class": "client_policy",
              "mechanism": "client_interpreter",
              "guarantee": "client_scoped"
            },
            "scope": {
              "sourceLayer": "repository",
              "filesystemSelector": "exact_path",
              "subject": "config-layer",
              "temporalActivation": "startup_or_request"
            },
            "validity": {
              "syntax": "unverified",
              "support": "supported",
              "applicability": "conditional",
              "reasons": [
                "target_trust_branch_or_runtime_state_unresolved"
              ]
            },
            "lifecycle": {
              "highestEvidencedStage": "detected",
              "stages": [
                {
                  "stage": "detected",
                  "status": "observed",
                  "evidence": [
                    "path:.codex/config.toml"
                  ]
                }
              ],
              "loaded": "unverified",
              "matched": "unverified",
              "decisionEnforced": "unverified",
              "advisoryFollowed": "unverified"
            },
            "precedence": "active_config_layers_runtime_dependent",
            "officialSource": "https://learn.chatgpt.com/docs/config-file/config-basic"
          },
          {
            "tool": "codex",
            "surface": "codex_ide",
            "mode": "native",
            "enforcement": {
              "class": "client_policy",
              "mechanism": "client_interpreter",
              "guarantee": "client_scoped"
            },
            "scope": {
              "sourceLayer": "repository",
              "filesystemSelector": "exact_path",
              "subject": "config-layer",
              "temporalActivation": "startup_or_request"
            },
            "validity": {
              "syntax": "unverified",
              "support": "supported",
              "applicability": "conditional",
              "reasons": [
                "target_trust_branch_or_runtime_state_unresolved"
              ]
            },
            "lifecycle": {
              "highestEvidencedStage": "detected",
              "stages": [
                {
                  "stage": "detected",
                  "status": "observed",
                  "evidence": [
                    "path:.codex/config.toml"
                  ]
                }
              ],
              "loaded": "unverified",
              "matched": "unverified",
              "decisionEnforced": "unverified",
              "advisoryFollowed": "unverified"
            },
            "precedence": "active_config_layers_runtime_dependent",
            "officialSource": "https://learn.chatgpt.com/docs/config-file/config-basic"
          }
        ],